tweet_id,source,text,expanded_urls,rating_numerator,rating_denominator,name,dog_stage,date,time,retweet_count,favorite_count
679854723806179328,"<a href=""http://twitter.com/download/iphone"" rel=""nofollow"">Twitter for iPhone</a>",This is Bruce. He's a rare pup. Covered in Frosted Flakes. Nifty gold teeth. Overall good dog. 7/10 would pet firmly https://t.co/RtxxACzZ8A,https://twitter.com/dog_rates/status/679854723806179328/photo/1,7.0,10.0,Bruce,,2015-12-24,02:42:51,1166.0,2745.0
679844490799091713,"<a href=""http://twitter.com/download/iphone"" rel=""nofollow"">Twitter for iPhone</a>",This is Willie. He's floating away and needs your assistance. Please someone help Willie. 10/10 https://t.co/MJqygWqt8X,https://twitter.com/dog_rates/status/679844490799091713/photo/1,10.0,10.0,Willie,,2015-12-24,02:02:12,723.0,2278.0
679828447187857408,"<a href=""http://twitter.com/download/iphone"" rel=""nofollow"">Twitter for iPhone</a>",Everybody look at this beautiful pupper 13/10 https://t.co/hyAC5Hq9GC,"https://twitter.com/dog_rates/status/679828447187857408/photo/1,https://twitter.com/dog_rates/status/679828447187857408/photo/1,https://twitter.com/dog_rates/status/679828447187857408/photo/1",13.0,10.0,,Pupper,2015-12-24,00:58:27,13343.0,34729.0
679777920601223168,"<a href=""http://twitter.com/download/iphone"" rel=""nofollow"">Twitter for iPhone</a>",This is Rinna. She's melting. 10/10 get inside pupper https://t.co/PA0czwucsb,https://twitter.com/dog_rates/status/679777920601223168/photo/1,10.0,10.0,Rinna,Pupper,2015-12-23,21:37:40,1045.0,2993.0
679736210798047232,"<a href=""http://twitter.com/download/iphone"" rel=""nofollow"">Twitter for iPhone</a>",This pup's name is Sabertooth (parents must be cool). Ears for days. Jumps unannounced. 9/10 would pet diligently https://t.co/iazoiNUviP,https://twitter.com/dog_rates/status/679736210798047232/photo/1,9.0,10.0,,,2015-12-23,18:51:56,752.0,2007.0
679729593985699840,"<a href=""http://twitter.com/download/iphone"" rel=""nofollow"">Twitter for iPhone</a>",This is Hunter. He was playing with his ball minding his own business. Has no idea what happened to the carpet. 8/10 https://t.co/DbUTDI3u1R,https://twitter.com/dog_rates/status/679729593985699840/photo/1,8.0,10.0,Hunter,,2015-12-23,18:25:38,789.0,2080.0
679722016581222400,"<a href=""http://twitter.com/download/iphone"" rel=""nofollow"">Twitter for iPhone</a>",This is Mike. He is a Jordanian Frito Pilates. Frowning because he can't see directly in front of him. 8/10 https://t.co/NL5QJwdEpF,https://twitter.com/dog_rates/status/679722016581222400/photo/1,8.0,10.0,Mike,,2015-12-23,17:55:32,447.0,1599.0
679530280114372609,"<a href=""http://twitter.com/download/iphone"" rel=""nofollow"">Twitter for iPhone</a>",Guys this really needs to stop. We've been over this way too many times. This is a giraffe. We only rate dogs.. 7/10 https://t.co/yavgkHYPOC,https://twitter.com/dog_rates/status/679530280114372609/photo/1,7.0,10.0,,,2015-12-23,05:13:38,1979.0,4576.0
679527802031484928,"<a href=""http://twitter.com/download/iphone"" rel=""nofollow"">Twitter for iPhone</a>",This little pupper just arrived. 11/10 would snug https://t.co/DA5aqnSGfB,https://twitter.com/dog_rates/status/679527802031484928/photo/1,11.0,10.0,,Pupper,2015-12-23,05:03:47,687.0,2533.0
679511351870550016,"<a href=""http://twitter.com/download/iphone"" rel=""nofollow"">Twitter for iPhone</a>",Say hello to William. He makes fun of others because he's terrified of his own deep-seated insecurities. 7/10 https://t.co/bwuV6FlRxr,https://twitter.com/dog_rates/status/679511351870550016/photo/1,7.0,10.0,William,,2015-12-23,03:58:25,1201.0,3234.0
679503373272485890,"<a href=""http://twitter.com/download/iphone"" rel=""nofollow"">Twitter for iPhone</a>",This is Dwight. He's a pointy pupper. Very docile. Attracts marshmallows. Hurts to pet but definitely worth it 8/10 https://t.co/jjW7zTxY9Z,https://twitter.com/dog_rates/status/679503373272485890/photo/1,8.0,10.0,Dwight,Pupper,2015-12-23,03:26:43,1397.0,3039.0
679475951516934144,"<a href=""http://twitter.com/download/iphone"" rel=""nofollow"">Twitter for iPhone</a>",This is Evy. She doesn't want to be a Koala. 9/10 https://t.co/VITeF0Kl9L,https://twitter.com/dog_rates/status/679475951516934144/photo/1,9.0,10.0,Evy,,2015-12-23,01:37:45,611.0,2010.0
679462823135686656,"<a href=""http://twitter.com/download/iphone"" rel=""nofollow"">Twitter for iPhone</a>",Meet Hurley. He's the curly one. He hugs every other dog he sees during his walk. 11/10 for spreading the love https://t.co/M6vqkt2GKV,https://twitter.com/dog_rates/status/679462823135686656/photo/1,11.0,10.0,Hurley,,2015-12-23,00:45:35,17842.0,30178.0
679405845277462528,"<a href=""http://vine.co"" rel=""nofollow"">Vine - Make a Scene</a>",Crazy unseen footage from Jurassic Park. 10/10 for both dinosaur puppers https://t.co/L8wt2IpwxO,https://vine.co/v/iKVFEigMLxP,10.0,10.0,,,2015-12-22,20:59:10,1142.0,2272.0
679158373988876288,"<a href=""http://twitter.com/download/iphone"" rel=""nofollow"">Twitter for iPhone</a>",This is Rubio. He has too much skin. 11/10 https://t.co/NLOHmlENag,https://twitter.com/dog_rates/status/679158373988876288/photo/1,11.0,10.0,Rubio,,2015-12-22,04:35:49,7639.0,20371.0
679148763231985668,"<a href=""http://twitter.com/download/iphone"" rel=""nofollow"">Twitter for iPhone</a>",I know everyone's excited for Christmas but that doesn't mean you can send in reindeer. We only rate dogs... 8/10 https://t.co/eWjWgbOCYL,https://twitter.com/dog_rates/status/679148763231985668/photo/1,8.0,10.0,,,2015-12-22,03:57:37,972.0,2676.0
679132435750195208,"<a href=""http://twitter.com/download/iphone"" rel=""nofollow"">Twitter for iPhone</a>",This is Louis. He's a river dancer. His friends think it's badass. All are very supportive. 10/10 for Louis https://t.co/qoIvjKMY58,https://twitter.com/dog_rates/status/679132435750195208/photo/1,10.0,10.0,Louis,,2015-12-22,02:52:45,1101.0,2854.0
679111216690831360,"<a href=""http://twitter.com/download/iphone"" rel=""nofollow"">Twitter for iPhone</a>",This is officially the greatest yawn of all time. 12/10 https://t.co/4R0Cc0sLVE,https://twitter.com/dog_rates/status/679111216690831360/video/1,12.0,10.0,,,2015-12-22,01:28:25,2455.0,5701.0
679062614270468097,"<a href=""http://twitter.com/download/iphone"" rel=""nofollow"">Twitter for iPhone</a>",This is Chompsky. He lives up to his name. 11/10 https://t.co/Xl37lQEWd0,"https://twitter.com/dog_rates/status/679062614270468097/photo/1,https://twitter.com/dog_rates/status/679062614270468097/photo/1",11.0,10.0,Chompsky,,2015-12-21,22:15:18,7647.0,16218.0
679047485189439488,"<a href=""http://twitter.com/download/iphone"" rel=""nofollow"">Twitter for iPhone</a>",This dog doesn't know how to stairs. Quite tragic really. 9/10 get it together pup https://t.co/kTpr9PTMg1,https://twitter.com/dog_rates/status/679047485189439488/photo/1,9.0,10.0,,,2015-12-21,21:15:11,627.0,2152.0
679001094530465792,"<a href=""http://vine.co"" rel=""nofollow"">Vine - Make a Scene</a>",This is Rascal. He's paddling an imaginary canoe. 11/10 https://t.co/Ajquq6oGSg,https://vine.co/v/iKIwAzEatd6,11.0,10.0,Rascal,,2015-12-21,18:10:50,1163.0,2723.0
678991772295516161,"<a href=""http://twitter.com/download/iphone"" rel=""nofollow"">Twitter for iPhone</a>",If your Monday isn't going so well just take a look at this. Both 12/10 https://t.co/GJT6SILPGU,https://twitter.com/dog_rates/status/678991772295516161/photo/1,12.0,10.0,,,2015-12-21,17:33:48,1095.0,2181.0
678969228704284672,"<a href=""http://twitter.com/download/iphone"" rel=""nofollow"">Twitter for iPhone</a>",Meet Lola. She's a Metamorphic Chartreuse. Plays with her food. Insubordinate and churlish. Exquisite hardwood 11/10 https://t.co/etpBNXwN7f,https://twitter.com/dog_rates/status/678969228704284672/photo/1,11.0,10.0,Lola,,2015-12-21,16:04:13,432.0,1564.0
678800283649069056,"<a href=""http://twitter.com/download/iphone"" rel=""nofollow"">Twitter for iPhone</a>",Here's a pupper with some mean tan lines. Snazzy sweater though 12/10 https://t.co/DpCSVsl6vu,https://twitter.com/dog_rates/status/678800283649069056/photo/1,12.0,10.0,,Pupper,2015-12-21,04:52:53,855.0,2463.0
678798276842360832,"<a href=""http://twitter.com/download/iphone"" rel=""nofollow"">Twitter for iPhone</a>",This is Linda. She fucking hates trees. 7/10 https://t.co/blaY85FIxR,https://twitter.com/dog_rates/status/678798276842360832/photo/1,7.0,10.0,Linda,,2015-12-21,04:44:55,1095.0,3312.0
678774928607469569,"<a href=""http://twitter.com/download/iphone"" rel=""nofollow"">Twitter for iPhone</a>",This is Tug. He's not required to wear the cone he just wants his voice to project more clearly. 11/10 https://t.co/Sp739Ou2qx,https://twitter.com/dog_rates/status/678774928607469569/photo/1,11.0,10.0,Tug,,2015-12-21,03:12:08,858.0,2690.0
678767140346941444,"<a href=""http://twitter.com/download/iphone"" rel=""nofollow"">Twitter for iPhone</a>",This is Mia. She makes awful decisions. 8/10 https://t.co/G6TQVgTcZz,https://twitter.com/dog_rates/status/678767140346941444/photo/1,8.0,10.0,Mia,,2015-12-21,02:41:11,1291.0,3373.0
678764513869611008,"<a href=""http://twitter.com/download/iphone"" rel=""nofollow"">Twitter for iPhone</a>","Meet Wilson. He got caught humping the futon. He's like ""dude, help me out here"" 10/10 I'd help Wilson out https://t.co/m6XoclB0qv",https://twitter.com/dog_rates/status/678764513869611008/photo/1,10.0,10.0,Wilson,,2015-12-21,02:30:45,442.0,1557.0
678755239630127104,"<a href=""http://twitter.com/download/iphone"" rel=""nofollow"">Twitter for iPhone</a>",This is Dash. He didn't think the water would be that cold. Damn it Dash it's December. Think a little. 10/10 https://t.co/NqcOwG8pxW,https://twitter.com/dog_rates/status/678755239630127104/photo/1,10.0,10.0,Dash,,2015-12-21,01:53:54,3100.0,6770.0
678740035362037760,"<a href=""http://twitter.com/download/iphone"" rel=""nofollow"">Twitter for iPhone</a>",Meet Tango. He's a large dog. Doesn't care much for personal space. Owner isn't very accepting. Tongue slip. 6/10 https://t.co/p2T5kGebxe,https://twitter.com/dog_rates/status/678740035362037760/photo/1,6.0,10.0,Tango,,2015-12-21,00:53:29,1573.0,3585.0
678708137298427904,"<a href=""http://vine.co"" rel=""nofollow"">Vine - Make a Scene</a>",Here we are witnessing a wild field pupper. Lost his wallet in there. Rather unfortunate. 10/10 good luck pup https://t.co/sZy9Co74Bw,https://vine.co/v/eQjxxYaQ60K,10.0,10.0,,Pupper,2015-12-20,22:46:44,2302.0,5349.0
678675843183484930,"<a href=""http://twitter.com/download/iphone"" rel=""nofollow"">Twitter for iPhone</a>",Exotic pup here. Tail long af. Throat looks swollen. Might breathe fire. Exceptionally unfluffy 2/10 would still pet https://t.co/a8SqCaSo2r,https://twitter.com/dog_rates/status/678675843183484930/photo/1,2.0,10.0,,,2015-12-20,20:38:24,1387.0,2730.0
678643457146150913,"<a href=""http://twitter.com/download/iphone"" rel=""nofollow"">Twitter for iPhone</a>",Meet Grizz. He just arrived. Couldn't wait until Christmas. Worried bc he saw the swastikas on the carpet. 10/10 https://t.co/QBGwYrT7rv,https://twitter.com/dog_rates/status/678643457146150913/photo/1,10.0,10.0,Grizz,,2015-12-20,18:29:43,383.0,1963.0
678446151570427904,"<a href=""http://twitter.com/download/iphone"" rel=""nofollow"">Twitter for iPhone</a>",Touching scene here. Really stirs up the emotions. The bond between father &amp; son. So beautiful. 10/10 for both pups https://t.co/AJWJHov5gx,https://twitter.com/dog_rates/status/678446151570427904/photo/1,10.0,10.0,,,2015-12-20,05:25:42,1452.0,3823.0
678424312106393600,"<a href=""http://twitter.com/download/iphone"" rel=""nofollow"">Twitter for iPhone</a>",This is Crystal. She's a shitty fireman. No sense of urgency. People could be dying Crystal. 2/10 just irresponsible https://t.co/rtMtjSl9pz,https://twitter.com/dog_rates/status/678424312106393600/photo/1,2.0,10.0,Crystal,,2015-12-20,03:58:55,2410.0,5220.0
678410210315247616,"<a href=""http://twitter.com/download/iphone"" rel=""nofollow"">Twitter for iPhone</a>",Say hello to Jerome. He can shoot french fries out of his mouth at insane speeds. Deadly af. 10/10 https://t.co/dIy88HwrX8,https://twitter.com/dog_rates/status/678410210315247616/photo/1,10.0,10.0,Jerome,,2015-12-20,03:02:53,1705.0,4009.0
678399652199309312,"<a href=""http://twitter.com/download/iphone"" rel=""nofollow"">Twitter for iPhone</a>",This made my day. 12/10 please enjoy https://t.co/VRTbo3aAcm,https://twitter.com/dog_rates/status/678399652199309312/video/1,12.0,10.0,,,2015-12-20,02:20:55,30134.0,76542.0
678396796259975168,"<a href=""http://twitter.com/download/iphone"" rel=""nofollow"">Twitter for iPhone</a>",These little fellas have opposite facial expressions. Both 12/10 https://t.co/LmThv0GWen,"https://twitter.com/dog_rates/status/678396796259975168/photo/1,https://twitter.com/dog_rates/status/678396796259975168/photo/1",12.0,10.0,,,2015-12-20,02:09:34,396.0,1522.0
678389028614488064,"<a href=""http://twitter.com/download/iphone"" rel=""nofollow"">Twitter for iPhone</a>","This is Bella. She just learned that her final grade in chem was a 92.49 
poor pupper 11/10 https://t.co/auOoKuoveM",https://twitter.com/dog_rates/status/678389028614488064/photo/1,11.0,10.0,Bella,Pupper,2015-12-20,01:38:42,401.0,1776.0
678380236862578688,"<a href=""http://twitter.com/download/iphone"" rel=""nofollow"">Twitter for iPhone</a>",This is Crumpet. He underestimated the snow. Quickly retreating. 10/10 https://t.co/a0Zx5LDFZa,https://twitter.com/dog_rates/status/678380236862578688/photo/1,10.0,10.0,Crumpet,,2015-12-20,01:03:46,852.0,2318.0
678341075375947776,"<a href=""http://twitter.com/download/iphone"" rel=""nofollow"">Twitter for iPhone</a>",This pupper likes tape. 12/10 https://t.co/cSp6w5GWgm,https://twitter.com/dog_rates/status/678341075375947776/photo/1,12.0,10.0,,Pupper,2015-12-19,22:28:09,506.0,1647.0
678334497360859136,"<a href=""http://twitter.com/download/iphone"" rel=""nofollow"">Twitter for iPhone</a>",This is Rosie. She has a snazzy bow tie and a fin for a tail. Probably super fast underwater. Cool socks 10/10 https://t.co/GO76MdGBs0,https://twitter.com/dog_rates/status/678334497360859136/photo/1,10.0,10.0,Rosie,,2015-12-19,22:02:01,236.0,1238.0
678278586130948096,"<a href=""http://twitter.com/download/iphone"" rel=""nofollow"">Twitter for iPhone</a>",Another spooky pupper here. Most definitely floating. No legs. Probably knows some dark magic. 10/10 very spooked https://t.co/JK8MByRzgj,https://twitter.com/dog_rates/status/678278586130948096/photo/1,10.0,10.0,,Pupper,2015-12-19,18:19:51,5778.0,10912.0
678255464182861824,"<a href=""http://twitter.com/download/iphone"" rel=""nofollow"">Twitter for iPhone</a>",This is Jessifer. She is a Bismoth Teriyaki. Flowers being attacked by hurricanes on bandana (rad). 9/10 stellar pup https://t.co/nZhmRwZzWv,https://twitter.com/dog_rates/status/678255464182861824/photo/1,9.0,10.0,Jessifer,,2015-12-19,16:47:58,348.0,1515.0
678021115718029313,"<a href=""http://twitter.com/download/iphone"" rel=""nofollow"">Twitter for iPhone</a>",This is Reese. He likes holding hands. 12/10 https://t.co/cbLroGCbmh,https://twitter.com/dog_rates/status/678021115718029313/photo/1,12.0,10.0,Reese,,2015-12-19,01:16:45,5964.0,12957.0
677961670166224897,"<a href=""http://vine.co"" rel=""nofollow"">Vine - Make a Scene</a>",This is Izzy. She's showing off the dance moves she's been working on. 11/10 I guess hard work pays off https://t.co/4JS92YAxTi,https://vine.co/v/iKuMDuYV0aZ,11.0,10.0,Izzy,,2015-12-18,21:20:32,1598.0,3258.0
677918531514703872,"<a href=""http://twitter.com/download/iphone"" rel=""nofollow"">Twitter for iPhone</a>","""Everything looks pretty good in there. Make sure to brush your gums. Been flossing? How's school going?"" Both 10/10 https://t.co/lWL2IMJqLR",https://twitter.com/dog_rates/status/677918531514703872/photo/1,10.0,10.0,,,2015-12-18,18:29:07,384.0,1276.0
677895101218201600,"<a href=""http://twitter.com/download/iphone"" rel=""nofollow"">Twitter for iPhone</a>",Guys this was terrifying. Really spooked me up. We don't rate ghosts. We rate dogs. Please only send dogs... 9/10 https://t.co/EJImi1udYb,https://twitter.com/dog_rates/status/677895101218201600/photo/1,9.0,10.0,,,2015-12-18,16:56:01,1956.0,4592.0
677716515794329600,"<a href=""http://twitter.com/download/iphone"" rel=""nofollow"">Twitter for iPhone</a>",IT'S PUPPERGEDDON. Total of 144/120 ...I think https://t.co/ZanVtAtvIq,https://twitter.com/dog_rates/status/677716515794329600/photo/1,12.0,10.0,,,2015-12-18,05:06:23,923.0,2902.0
677700003327029250,"<a href=""http://twitter.com/download/iphone"" rel=""nofollow"">Twitter for iPhone</a>",This is Ralph. He's an interpretive dancer. 10/10 https://t.co/zoDdPyPFsa,https://twitter.com/dog_rates/status/677700003327029250/photo/1,10.0,10.0,Ralph,,2015-12-18,04:00:46,1365.0,3228.0
677698403548192770,"<a href=""http://twitter.com/download/iphone"" rel=""nofollow"">Twitter for iPhone</a>",This is Sadie. She got her holidays confused. 9/10 damn it Sadie https://t.co/fm7HxOsuPK,https://twitter.com/dog_rates/status/677698403548192770/photo/1,9.0,10.0,Sadie,,2015-12-18,03:54:25,303.0,1174.0
677687604918272002,"<a href=""http://twitter.com/download/iphone"" rel=""nofollow"">Twitter for iPhone</a>",This was Cindy's face when she heard Susan forgot the snacks for after the kid's soccer game. 11/10 https://t.co/gzkuVGRgAD,https://twitter.com/dog_rates/status/677687604918272002/photo/1,11.0,10.0,,,2015-12-18,03:11:30,798.0,2379.0
677673981332312066,"<a href=""http://twitter.com/download/iphone"" rel=""nofollow"">Twitter for iPhone</a>",Endangered triangular pup here. Could be a wizard. Caught mid-laugh. No legs. Just fluff. Probably a wizard. 9/10 https://t.co/GFVIHIod0Z,https://twitter.com/dog_rates/status/677673981332312066/photo/1,9.0,10.0,,,2015-12-18,02:17:22,1418.0,3169.0
677662372920729601,"<a href=""http://twitter.com/download/iphone"" rel=""nofollow"">Twitter for iPhone</a>","In honor of the new Star Wars movie. Here's Yoda pug. 12/10 pet really well, would I https://t.co/pvjdRn00XH",https://twitter.com/dog_rates/status/677662372920729601/photo/1,12.0,10.0,,,2015-12-18,01:31:14,894.0,1852.0
677644091929329666,"<a href=""http://twitter.com/download/iphone"" rel=""nofollow"">Twitter for iPhone</a>",This is a dog swinging. I really enjoyed it so I hope you all do as well. 11/10 https://t.co/Ozo9KHTRND,https://twitter.com/dog_rates/status/677644091929329666/video/1,11.0,10.0,,,2015-12-18,00:18:36,763.0,1774.0
677573743309385728,"<a href=""http://twitter.com/download/iphone"" rel=""nofollow"">Twitter for iPhone</a>",This is Sandy. He's sexually confused. Thinks he's a pigeon. Also an All-American cheese catcher. 10/10 so petable https://t.co/Htu8plSqEu,"https://twitter.com/dog_rates/status/677573743309385728/photo/1,https://twitter.com/dog_rates/status/677573743309385728/photo/1",10.0,10.0,Sandy,,2015-12-17,19:39:03,658.0,2038.0
677565715327688705,"<a href=""http://twitter.com/download/iphone"" rel=""nofollow"">Twitter for iPhone</a>",Contortionist pup here. Inside pentagram. Clearly worships Satan. Known to slowly push fragile stuff off tables 6/10 https://t.co/EX9oR55VMe,https://twitter.com/dog_rates/status/677565715327688705/photo/1,6.0,10.0,,,2015-12-17,19:07:09,434.0,1241.0
677557565589463040,"<a href=""http://twitter.com/download/iphone"" rel=""nofollow"">Twitter for iPhone</a>",Reckless pupper here. Not even looking at road. Absolute menace. No regard for fellow pupper lives. 10/10 still cute https://t.co/96IBkOYB7j,https://twitter.com/dog_rates/status/677557565589463040/photo/1,10.0,10.0,,Pupper,2015-12-17,18:34:46,1091.0,2332.0
677547928504967168,"<a href=""http://twitter.com/download/iphone"" rel=""nofollow"">Twitter for iPhone</a>",Not much to say here. I just think everyone needs to see this. 12/10 https://t.co/AGag0hFHpe,https://twitter.com/dog_rates/status/677547928504967168/photo/1,12.0,10.0,,,2015-12-17,17:56:29,3475.0,6597.0
677530072887205888,"<a href=""http://twitter.com/download/iphone"" rel=""nofollow"">Twitter for iPhone</a>",Say hello to Axel. He's a Black Chevy Pinot on wheels. 0 to 60 in 5.7 seconds (if downhill). 9/10 I call shotgun https://t.co/DKe9DBnnHE,https://twitter.com/dog_rates/status/677530072887205888/photo/1,9.0,10.0,Axel,,2015-12-17,16:45:31,217.0,1017.0
677335745548390400,"<a href=""http://vine.co"" rel=""nofollow"">Vine - Make a Scene</a>",Downright inspiring 12/10 https://t.co/vSLtYBWHcQ,https://vine.co/v/hbLbH77Ar67,12.0,10.0,,,2015-12-17,03:53:20,1652.0,2889.0
677334615166730240,"<a href=""http://twitter.com/download/iphone"" rel=""nofollow"">Twitter for iPhone</a>",This dog gave up mid jump. 9/10 https://t.co/KmMv3Y2zI8,"https://twitter.com/dog_rates/status/677334615166730240/photo/1,https://twitter.com/dog_rates/status/677334615166730240/photo/1",9.0,10.0,,,2015-12-17,03:48:51,269.0,1280.0
677331501395156992,"<a href=""http://twitter.com/download/iphone"" rel=""nofollow"">Twitter for iPhone</a>",Meet Humphrey. He's a Northern Polyp Viagra. One ear works. Face stuck like that. Always surprised. 9/10 petable af https://t.co/FS7eJQM2F4,https://twitter.com/dog_rates/status/677331501395156992/photo/1,9.0,10.0,Humphrey,,2015-12-17,03:36:28,222.0,1038.0
677328882937298944,"<a href=""http://twitter.com/download/iphone"" rel=""nofollow"">Twitter for iPhone</a>",This is Derek. All the dogs adore Derek. He's a great guy. 10/10 really solid pup https://t.co/KgcsGNb61s,https://twitter.com/dog_rates/status/677328882937298944/photo/1,10.0,10.0,Derek,,2015-12-17,03:26:04,1423.0,3481.0
677314812125323265,"<a href=""http://twitter.com/download/iphone"" rel=""nofollow"">Twitter for iPhone</a>","Meet Tassy &amp; Bee. Tassy is pretty chill, but Bee is convinced the Ruffles are haunted. 10/10 &amp; 11/10 respectively https://t.co/fgORpmTN9C","https://twitter.com/dog_rates/status/677314812125323265/photo/1,https://twitter.com/dog_rates/status/677314812125323265/photo/1",10.0,10.0,Tassy,,2015-12-17,02:30:09,504.0,1572.0
677301033169788928,"<a href=""http://twitter.com/download/iphone"" rel=""nofollow"">Twitter for iPhone</a>",This is Juckson. He's totally on his way to a nascar race. 5/10 for Juckson https://t.co/IoLRvF0Kak,https://twitter.com/dog_rates/status/677301033169788928/photo/1,5.0,10.0,Juckson,,2015-12-17,01:35:24,382.0,1170.0
677269281705472000,"<a href=""http://twitter.com/download/iphone"" rel=""nofollow"">Twitter for iPhone</a>",This is the happiest pupper I've ever seen. 10/10 would trade lives with https://t.co/ep8ATEJwRb,https://twitter.com/dog_rates/status/677269281705472000/photo/1,10.0,10.0,,Pupper,2015-12-16,23:29:14,669.0,1878.0
677228873407442944,"<a href=""http://twitter.com/download/iphone"" rel=""nofollow"">Twitter for iPhone</a>",Say hello to Chuq. He just wants to fit in. 11/10 https://t.co/hGkMCjZzn4,https://twitter.com/dog_rates/status/677228873407442944/photo/1,11.0,10.0,Chuq,,2015-12-16,20:48:40,1549.0,3379.0
677187300187611136,"<a href=""http://twitter.com/download/iphone"" rel=""nofollow"">Twitter for iPhone</a>",Here we see a Byzantine Rigatoni. Very aerodynamic. No eyes. Actually not windy here they just look like that. 9/10 https://t.co/gzI0m6wXRo,https://twitter.com/dog_rates/status/677187300187611136/photo/1,9.0,10.0,,,2015-12-16,18:03:28,859.0,2592.0
676975532580409345,"<a href=""http://twitter.com/download/iphone"" rel=""nofollow"">Twitter for iPhone</a>",This is Cooper. He doesn't know how cheese works. Likes the way it feels on his face. Cheeky tongue slip. 11/10 https://t.co/j1zczS0lI5,https://twitter.com/dog_rates/status/676975532580409345/photo/1,11.0,10.0,Cooper,,2015-12-16,04:01:59,1009.0,2636.0
676957860086095872,"<a href=""http://twitter.com/download/iphone"" rel=""nofollow"">Twitter for iPhone</a>",10/10 I'd follow this dog into battle no questions asked https://t.co/ngTNXYQF0L,https://twitter.com/dog_rates/status/676957860086095872/video/1,10.0,10.0,,,2015-12-16,02:51:45,768.0,2128.0
676949632774234114,"<a href=""http://twitter.com/download/iphone"" rel=""nofollow"">Twitter for iPhone</a>",This is Tyrus. He's a Speckled Centennial Ticonderoga. Terrified of floating red ball. Nifty bandana. 8/10 v petable https://t.co/HqM3YhCaaa,https://twitter.com/dog_rates/status/676949632774234114/photo/1,8.0,10.0,Tyrus,,2015-12-16,02:19:04,372.0,1246.0
676948236477857792,"<a href=""http://twitter.com/download/iphone"" rel=""nofollow"">Twitter for iPhone</a>",This is Karl. Karl thinks he's slick. 6/10 sneaky pup https://t.co/Lo4ALwjVh4,https://twitter.com/dog_rates/status/676948236477857792/photo/1,6.0,10.0,Karl,,2015-12-16,02:13:31,812.0,2052.0
676946864479084545,"<a href=""http://twitter.com/download/iphone"" rel=""nofollow"">Twitter for iPhone</a>",This pups goal was to get all four feet as close to each other as possible. Valiant effort 12/10 https://t.co/2mXALbgBTV,https://twitter.com/dog_rates/status/676946864479084545/photo/1,12.0,10.0,,,2015-12-16,02:08:04,344.0,1647.0
676942428000112642,"<a href=""http://twitter.com/download/iphone"" rel=""nofollow"">Twitter for iPhone</a>",Who leaves the last cupcake just sitting there? 9/10 https://t.co/PWMqAoEx2a,https://twitter.com/dog_rates/status/676942428000112642/photo/1,9.0,10.0,,,2015-12-16,01:50:26,703.0,1968.0
676936541936185344,"<a href=""http://twitter.com/download/iphone"" rel=""nofollow"">Twitter for iPhone</a>",Here we see a rare pouched pupper. Ample storage space. Looks alert. Jumps at random. Kicked open that door. 8/10 https://t.co/mqvaxleHRz,https://twitter.com/dog_rates/status/676936541936185344/photo/1,8.0,10.0,,Pupper,2015-12-16,01:27:03,4671.0,12104.0
676916996760600576,"<a href=""http://vine.co"" rel=""nofollow"">Vine - Make a Scene</a>",Super speedy pupper. Does not go gentle into that goodnight. 10/10 https://t.co/uPXBXS1XNb,https://vine.co/v/imJ0BdZOJTw,10.0,10.0,,Pupper,2015-12-16,00:09:23,1711.0,2821.0
