tweet_id,source,text,expanded_urls,rating_numerator,rating_denominator,name,dog_stage,date,time,retweet_count,favorite_count
715704790270025728,"<a href=""http://vine.co"" rel=""nofollow"">Vine - Make a Scene</a>",This is Bentley. He gives kisses back. 11/10 precious af (vid by @emmaallen25) https://t.co/9PnKkKzoUp,https://vine.co/v/ijAlDnuOD0l,11.0,10.0,Bentley,,2016-04-01,00:58:13,546.0,2671.0
715696743237730304,"<a href=""http://twitter.com/download/iphone"" rel=""nofollow"">Twitter for iPhone</a>",Meet Toby. He's a Lithuanian High-Steppin Stickeroo. One of the more accomplished Stickeroos around. 10/10 so nifty https://t.co/cYPHuJYTjC,https://twitter.com/dog_rates/status/715696743237730304/photo/1,10.0,10.0,Toby,,2016-04-01,00:26:15,1234.0,3761.0
715680795826982913,"<a href=""http://twitter.com/download/iphone"" rel=""nofollow"">Twitter for iPhone</a>",This is Zeus. He's downright fabulous. 12/10 https://t.co/sSugyyRuTp,"https://twitter.com/dog_rates/status/715680795826982913/photo/1,https://twitter.com/dog_rates/status/715680795826982913/photo/1,https://twitter.com/dog_rates/status/715680795826982913/photo/1",12.0,10.0,Zeus,,2016-03-31,23:22:53,1531.0,4127.0
715360349751484417,"<a href=""http://twitter.com/download/iphone"" rel=""nofollow"">Twitter for iPhone</a>",This is Bertson. He just wants to say hi. 11/10 would boop nose https://t.co/hwv7Wq6gDA,https://twitter.com/dog_rates/status/715360349751484417/photo/1,11.0,10.0,Bertson,,2016-03-31,02:09:32,1493.0,5266.0
715342466308784130,"<a href=""http://twitter.com/download/iphone"" rel=""nofollow"">Twitter for iPhone</a>",This is Oscar. He's a world renowned snowball inspector. It's a ruff job but someone has to do it. 10/10 great guy https://t.co/vSufMAKm3C,"https://twitter.com/dog_rates/status/715342466308784130/photo/1,https://twitter.com/dog_rates/status/715342466308784130/photo/1",10.0,10.0,Oscar,,2016-03-31,00:58:29,656.0,2934.0
715220193576927233,"<a href=""http://twitter.com/download/iphone"" rel=""nofollow"">Twitter for iPhone</a>",This is Nico. His selfie game is strong af. Excellent use of a sneaky tongue slip. 10/10 star material https://t.co/1OBdJkMOFx,https://twitter.com/dog_rates/status/715220193576927233/photo/1,10.0,10.0,Nico,,2016-03-30,16:52:36,617.0,2330.0
715200624753819648,"<a href=""http://twitter.com/download/iphone"" rel=""nofollow"">Twitter for iPhone</a>",This is Michelangelope. He's half coffee cup. Rare af. 12/10 would hug until someone stopped me https://t.co/tvVDY0G911,https://twitter.com/dog_rates/status/715200624753819648/photo/1,12.0,10.0,Michelangelope,,2016-03-30,15:34:51,1780.0,4957.0
715009755312439296,"<a href=""http://twitter.com/download/iphone"" rel=""nofollow"">Twitter for iPhone</a>",This is Siba. She's remarkably mobile. Very sleepy as well. 12/10 would happily transport https://t.co/TjnI33RE1i,https://twitter.com/dog_rates/status/715009755312439296/photo/1,12.0,10.0,Siba,,2016-03-30,02:56:24,1167.0,3993.0
714982300363173890,"<a href=""http://twitter.com/download/iphone"" rel=""nofollow"">Twitter for iPhone</a>",This is Calbert. He forgot to clear his Google search history. 9/10 rookie mistake Calbert https://t.co/jRm5J3YCmj,https://twitter.com/dog_rates/status/714982300363173890/photo/1,9.0,10.0,Calbert,,2016-03-30,01:07:18,990.0,3579.0
714962719905021952,"<a href=""http://vine.co"" rel=""nofollow"">Vine - Make a Scene</a>",Just in case anyone's having a bad day. 12/10 would bounce with https://t.co/T9sgP9ttnQ,https://vine.co/v/inVtemLt9tE,12.0,10.0,,,2016-03-29,23:49:30,4047.0,7061.0
714957620017307648,"<a href=""http://twitter.com/download/iphone"" rel=""nofollow"">Twitter for iPhone</a>",This is Curtis. He's an Albino Haberdasher. Terrified of dandelions. They really spook him up. 10/10 it'll be ok pup https://t.co/s8YcfZrWhK,https://twitter.com/dog_rates/status/714957620017307648/photo/1,10.0,10.0,Curtis,,2016-03-29,23:29:14,1349.0,3996.0
714631576617938945,"<a href=""http://twitter.com/download/iphone"" rel=""nofollow"">Twitter for iPhone</a>",This is Benedict. He's a feisty pup. Needs a brushing. Portable af. Looks very angry actually. 4/10 might not pet https://t.co/3oeFfHjv0Z,https://twitter.com/dog_rates/status/714631576617938945/photo/1,4.0,10.0,Benedict,,2016-03-29,01:53:39,948.0,3149.0
714606013974974464,"<a href=""http://twitter.com/download/iphone"" rel=""nofollow"">Twitter for iPhone</a>",Here are two lil cuddly puppers. Both 12/10 would snug like so much https://t.co/zO4eb7C4tG,https://twitter.com/dog_rates/status/714606013974974464/photo/1,12.0,10.0,,,2016-03-29,00:12:05,880.0,3500.0
714485234495041536,"<a href=""http://vine.co"" rel=""nofollow"">Vine - Make a Scene</a>",This is Blitz. He screams. 10/10 (vid by @yeaahliv) https://t.co/MfW2aym5UF,https://vine.co/v/iDrOvVqq0A6,10.0,10.0,Blitz,,2016-03-28,16:12:09,1078.0,2559.0
714258258790387713,"<a href=""http://twitter.com/download/iphone"" rel=""nofollow"">Twitter for iPhone</a>","Meet Travis and Flurp. Travis is pretty chill but Flurp can't lie down properly. 10/10 &amp; 8/10
get it together Flurp https://t.co/Akzl5ynMmE",https://twitter.com/dog_rates/status/714258258790387713/photo/1,10.0,10.0,Travis,,2016-03-28,01:10:13,699.0,2921.0
714251586676113411,"<a href=""http://twitter.com/download/iphone"" rel=""nofollow"">Twitter for iPhone</a>",This is Thumas. He hates potted plants. 8/10 wtf Thumas https://t.co/rDVueNIcEi,"https://twitter.com/dog_rates/status/714251586676113411/photo/1,https://twitter.com/dog_rates/status/714251586676113411/photo/1",8.0,10.0,Thumas,,2016-03-28,00:43:43,800.0,3151.0
714214115368108032,"<a href=""http://twitter.com/download/iphone"" rel=""nofollow"">Twitter for iPhone</a>",Happy Easter from the squad! ðŸ‡ðŸ¶ 13/10 for all https://t.co/YMx4KWJUAB,https://twitter.com/dog_rates/status/714214115368108032/photo/1,13.0,10.0,,,2016-03-27,22:14:49,831.0,2195.0
714141408463036416,"<a href=""http://twitter.com/download/iphone"" rel=""nofollow"">Twitter for iPhone</a>","I know we only rate dogs, but since it's Easter I guess we could rate a bunny for a change. 10/10 petable as hell https://t.co/O2RlKXigHu",https://twitter.com/dog_rates/status/714141408463036416/photo/1,10.0,10.0,,,2016-03-27,17:25:54,1339.0,4157.0
713919462244790272,"<a href=""http://twitter.com/download/iphone"" rel=""nofollow"">Twitter for iPhone</a>",This is Kanu. He's a Freckled Ticonderoga. Simply flawless. 12/10 would perform an elaborate heist to capture https://t.co/7vyAzIURrE,https://twitter.com/dog_rates/status/713919462244790272/photo/1,12.0,10.0,Kanu,,2016-03-27,02:43:58,756.0,3164.0
713909862279876608,"<a href=""http://vine.co"" rel=""nofollow"">Vine - Make a Scene</a>",This is Doug. His nose is legendary af. 12/10 (vid by @probably_trey) https://t.co/7IWKfbfihS,https://vine.co/v/iDWlapaXWmm,12.0,10.0,Doug,,2016-03-27,02:05:49,518.0,1824.0
713900603437621249,"<a href=""http://twitter.com/download/iphone"" rel=""nofollow"">Twitter for iPhone</a>",Happy Saturday here's 9 puppers on a bench. 99/90 good work everybody https://t.co/mpvaVxKmc1,https://twitter.com/dog_rates/status/713900603437621249/photo/1,11.0,10.0,,,2016-03-27,01:29:02,697.0,2738.0
713761197720473600,"<a href=""http://twitter.com/download/iphone"" rel=""nofollow"">Twitter for iPhone</a>",This is Piper. She would really like that tennis ball core. Super sneaky tongue slip. 12/10 precious af https://t.co/QP6GHi5az9,"https://twitter.com/dog_rates/status/713761197720473600/photo/1,https://twitter.com/dog_rates/status/713761197720473600/photo/1",12.0,10.0,Piper,,2016-03-26,16:15:05,1304.0,4670.0
713411074226274305,"<a href=""http://twitter.com/download/iphone"" rel=""nofollow"">Twitter for iPhone</a>",Here we see an extremely rare Bearded Floofmallow. Only a few left in the wild. 11/10 would pet with a purpose https://t.co/jVJJKlPbvq,https://twitter.com/dog_rates/status/713411074226274305/photo/1,11.0,10.0,,,2016-03-25,17:03:49,1243.0,4267.0
713177543487135744,"<a href=""http://twitter.com/download/iphone"" rel=""nofollow"">Twitter for iPhone</a>",This is Lance. Lance doesn't give a shit. 10/10 we should all be more like Lance https://t.co/SqnG9Ap28J,https://twitter.com/dog_rates/status/713177543487135744/photo/1,10.0,10.0,Lance,,2016-03-25,01:35:51,2737.0,6951.0
713175907180089344,"<a href=""http://twitter.com/download/iphone"" rel=""nofollow"">Twitter for iPhone</a>",Say hello to Opie and Clarkus. Clarkus fell asleep so Opie buried him. Ruthless af 10/10 for both https://t.co/xT7XaY4gnW,https://twitter.com/dog_rates/status/713175907180089344/photo/1,10.0,10.0,Opie,,2016-03-25,01:29:21,1410.0,4283.0
712809025985978368,"<a href=""http://twitter.com/download/iphone"" rel=""nofollow"">Twitter for iPhone</a>",This is Stubert. He just arrived. 10/10 https://t.co/HVGs5aAKAn,https://twitter.com/dog_rates/status/712809025985978368/photo/1,10.0,10.0,Stubert,,2016-03-24,01:11:29,6426.0,18319.0
712717840512598017,"<a href=""http://twitter.com/download/iphone"" rel=""nofollow"">Twitter for iPhone</a>",Please don't send in any more polar bears. We only rate dogs. Thank you... 10/10 https://t.co/83RGhdIQz2,https://twitter.com/dog_rates/status/712717840512598017/photo/1,10.0,10.0,,,2016-03-23,19:09:09,4740.0,11840.0
712668654853337088,"<a href=""http://twitter.com/download/iphone"" rel=""nofollow"">Twitter for iPhone</a>",Say hello to Sunny and Roxy. They pull things out of water together. 10/10 for both https://t.co/88aedAmxcl,"https://twitter.com/dog_rates/status/712668654853337088/photo/1,https://twitter.com/dog_rates/status/712668654853337088/photo/1,https://twitter.com/dog_rates/status/712668654853337088/photo/1",10.0,10.0,Sunny,,2016-03-23,15:53:42,1156.0,4010.0
712438159032893441,"<a href=""http://twitter.com/download/iphone"" rel=""nofollow"">Twitter for iPhone</a>",This is Kane. He's a semi-submerged Haitian Huffleplop. Happy af. Sick waterfall. 11/10 would pat head approvingly https://t.co/7zjEC501Ul,https://twitter.com/dog_rates/status/712438159032893441/photo/1,11.0,10.0,Kane,,2016-03-23,00:37:48,1500.0,5124.0
712309440758808576,"<a href=""http://twitter.com/download/iphone"" rel=""nofollow"">Twitter for iPhone</a>","Reminder that we made our first set of stickers available! All are 12/10 would stick
Use code ""pupper"" at checkoutðŸ¶

https://t.co/kJIMNyMNKV",https://twitter.com/stickergrub/status/709919141004595201,12.0,10.0,,Pupper,2016-03-22,16:06:19,25.0,228.0
712097430750289920,"<a href=""http://twitter.com/download/iphone"" rel=""nofollow"">Twitter for iPhone</a>",I can't even comprehend how confused this dog must be right now. 10/10 https://t.co/8AGcQ4hIfK,https://twitter.com/dog_rates/status/712097430750289920/photo/1,10.0,10.0,,,2016-03-22,02:03:52,989.0,3630.0
712092745624633345,"<a href=""http://twitter.com/download/iphone"" rel=""nofollow"">Twitter for iPhone</a>",This is Steven. He's inverted af. Also very helpful. Scans anything you want for free. Takes him a while tho. 7/10 https://t.co/tA0ZiQ7JcG,https://twitter.com/dog_rates/status/712092745624633345/photo/1,7.0,10.0,Steven,,2016-03-22,01:45:15,851.0,2835.0
712085617388212225,"<a href=""http://twitter.com/download/iphone"" rel=""nofollow"">Twitter for iPhone</a>","Say hello to Olive and Ruby. They are best buddies. Both 11/10 
1 like = 1 buddy https://t.co/yagmFdKlyL","https://twitter.com/dog_rates/status/712085617388212225/photo/1,https://twitter.com/dog_rates/status/712085617388212225/photo/1,https://twitter.com/dog_rates/status/712085617388212225/photo/1",11.0,10.0,Olive,,2016-03-22,01:16:55,465.0,3153.0
712065007010385924,"<a href=""http://twitter.com/download/iphone"" rel=""nofollow"">Twitter for iPhone</a>",This is Chester. He's clearly in charge of the other dogs. Weird ass paws. Not fit for fetch. 6/10 would still pet https://t.co/o2GvskrhHt,https://twitter.com/dog_rates/status/712065007010385924/photo/1,6.0,10.0,Chester,,2016-03-21,23:55:01,595.0,2173.0
711968124745228288,"<a href=""http://twitter.com/download/iphone"" rel=""nofollow"">Twitter for iPhone</a>",Meet Winston. He's trapped in a cup of coffee. Poor pupper. 10/10 someone free him https://t.co/2e6cUtKUuc,https://twitter.com/dog_rates/status/711968124745228288/photo/1,10.0,10.0,Winston,Pupper,2016-03-21,17:30:03,2202.0,7746.0
711743778164514816,"<a href=""http://twitter.com/download/iphone"" rel=""nofollow"">Twitter for iPhone</a>",Meet Roosevelt. He's calculating the best case scenario if he drops out instead of doing math hw. 11/10 relatable af https://t.co/QcSIRDpfVg,https://twitter.com/dog_rates/status/711743778164514816/photo/1,11.0,10.0,Roosevelt,,2016-03-21,02:38:34,952.0,2733.0
711732680602345472,"<a href=""http://twitter.com/download/iphone"" rel=""nofollow"">Twitter for iPhone</a>",I want to hear the joke this dog was just told. 10/10 https://t.co/1KiuZqqOD4,"https://twitter.com/dog_rates/status/711732680602345472/photo/1,https://twitter.com/dog_rates/status/711732680602345472/photo/1,https://twitter.com/dog_rates/status/711732680602345472/photo/1",10.0,10.0,,,2016-03-21,01:54:29,3895.0,8470.0
711694788429553666,"<a href=""http://twitter.com/download/iphone"" rel=""nofollow"">Twitter for iPhone</a>",Oh. My. God. 13/10 magical af https://t.co/Ezu6jQrKAZ,https://twitter.com/dog_rates/status/711694788429553666/photo/1,13.0,10.0,,,2016-03-20,23:23:54,17502.0,31567.0
711652651650457602,"<a href=""http://twitter.com/download/iphone"" rel=""nofollow"">Twitter for iPhone</a>",This is Gary. He just wanted to say hi. 9/10 very personable pup https://t.co/Sk3CbhmKSW,https://twitter.com/dog_rates/status/711652651650457602/photo/1,9.0,10.0,Gary,,2016-03-20,20:36:28,867.0,3713.0
711363825979756544,"<a href=""http://twitter.com/download/iphone"" rel=""nofollow"">Twitter for iPhone</a>","""Please, no puparazzi"" 11/10 https://t.co/nJIXSPfedK","https://twitter.com/dog_rates/status/711363825979756544/photo/1,https://twitter.com/dog_rates/status/711363825979756544/photo/1",11.0,10.0,,,2016-03-20,01:28:47,1084.0,3501.0
711306686208872448,"<a href=""http://twitter.com/download/iphone"" rel=""nofollow"">Twitter for iPhone</a>",What hooligan sent in pictures w/out a dog in them? Churlish af. 3/10 just bc that's a neat fluffy bean bag chair https://t.co/wcwoGOkZvz,"https://twitter.com/dog_rates/status/711306686208872448/photo/1,https://twitter.com/dog_rates/status/711306686208872448/photo/1",3.0,10.0,,,2016-03-19,21:41:44,709.0,3178.0
711008018775851008,"<a href=""http://twitter.com/download/iphone"" rel=""nofollow"">Twitter for iPhone</a>",This is Chuckles. He had a balloon but he accidentally let go of it and it floated away. 11/10 hang in there pupper https://t.co/68iNM7B5gW,https://twitter.com/dog_rates/status/711008018775851008/photo/1,11.0,10.0,Chuckles,Pupper,2016-03-19,01:54:56,585.0,2883.0
710997087345876993,"<a href=""http://twitter.com/download/iphone"" rel=""nofollow"">Twitter for iPhone</a>",Meet Milo and Amos. They are the best of pals. Both 12/10 would pet at the same time https://t.co/Mv37BHEyyD,https://twitter.com/dog_rates/status/710997087345876993/photo/1,12.0,10.0,Milo,,2016-03-19,01:11:29,1327.0,4404.0
710844581445812225,"<a href=""http://twitter.com/download/iphone"" rel=""nofollow"">Twitter for iPhone</a>",This is Staniel. His selfie game is strong af. 10/10 I'd snapchat with Staniel https://t.co/UgkTw7TKyM,https://twitter.com/dog_rates/status/710844581445812225/photo/1,10.0,10.0,Staniel,,2016-03-18,15:05:29,651.0,2447.0
710833117892898816,"<a href=""http://twitter.com/download/iphone"" rel=""nofollow"">Twitter for iPhone</a>",Say hello to Sora. She's an Egyptian Pumpernickel. Mesmerizing af. 12/10 would bring home to mom https://t.co/PmTR4kxZkq,https://twitter.com/dog_rates/status/710833117892898816/photo/1,12.0,10.0,Sora,,2016-03-18,14:19:56,507.0,2587.0
710658690886586372,"<a href=""http://twitter.com/download/iphone"" rel=""nofollow"">Twitter for iPhone</a>",Here's a brigade of puppers. All look very prepared for whatever happens next. 80/80 https://t.co/0eb7R1Om12,https://twitter.com/dog_rates/status/710658690886586372/photo/1,10.0,10.0,,,2016-03-18,02:46:49,537.0,2228.0
710609963652087808,"<a href=""http://vine.co"" rel=""nofollow"">Vine - Make a Scene</a>",I've watched this a million times and you probably will too. 12/10 (vid by @emily_galasso) https://t.co/DU7Rb3NDiy,https://vine.co/v/idaTpwH5TgU,12.0,10.0,,,2016-03-17,23:33:12,2277.0,4619.0
710588934686908417,"<a href=""http://twitter.com/download/iphone"" rel=""nofollow"">Twitter for iPhone</a>",This is Beemo. He's a Chubberflop mix. 12/10 would cross the world for https://t.co/kzMVMU8HBV,"https://twitter.com/dog_rates/status/710588934686908417/photo/1,https://twitter.com/dog_rates/status/710588934686908417/photo/1,https://twitter.com/dog_rates/status/710588934686908417/photo/1,https://twitter.com/dog_rates/status/710588934686908417/photo/1",12.0,10.0,Beemo,,2016-03-17,22:09:38,1779.0,4366.0
710296729921429505,"<a href=""http://vine.co"" rel=""nofollow"">Vine - Make a Scene</a>",This is Oshie. 12/10 please enjoy (vid by @catherinec1389) https://t.co/VmtzwAuotq,https://vine.co/v/iw9hUFAMerV,12.0,10.0,Oshie,,2016-03-17,02:48:31,705.0,2290.0
710283270106132480,"<a href=""http://twitter.com/download/iphone"" rel=""nofollow"">Twitter for iPhone</a>",This is Gunner. He's a Figamus Newton. King of the peek-a-boo. Cool jeans. 11/10 https://t.co/ONuBILIYXZ,"https://twitter.com/dog_rates/status/710283270106132480/photo/1,https://twitter.com/dog_rates/status/710283270106132480/photo/1",11.0,10.0,Gunner,,2016-03-17,01:55:02,498.0,2078.0
710272297844797440,"<a href=""http://twitter.com/download/iphone"" rel=""nofollow"">Twitter for iPhone</a>",We ðŸ‘ðŸ» only ðŸ‘ðŸ» rate ðŸ‘ðŸ» dogs. Pls stop sending in non-canines like this Dutch Panda Worm. This is infuriating. 11/10 https://t.co/odfLzBonG2,https://twitter.com/dog_rates/status/710272297844797440/photo/1,11.0,10.0,,,2016-03-17,01:11:26,1201.0,4353.0
710269109699739648,"<a href=""http://twitter.com/download/iphone"" rel=""nofollow"">Twitter for iPhone</a>","The squad is back for St. Patrick's Day! â˜˜ ðŸ’š
13/10 for all https://t.co/OcCDb2bng5",https://twitter.com/dog_rates/status/710269109699739648/photo/1,13.0,10.0,,,2016-03-17,00:58:46,1071.0,2306.0
710153181850935296,"<a href=""http://twitter.com/download/iphone"" rel=""nofollow"">Twitter for iPhone</a>",This is Lacy. She's tipping her hat to you. Daydreams of her life back on the frontier. 11/10 would pet so well https://t.co/fG5Pk3Et1I,"https://twitter.com/dog_rates/status/710153181850935296/photo/1,https://twitter.com/dog_rates/status/710153181850935296/photo/1",11.0,10.0,Lacy,,2016-03-16,17:18:07,858.0,2809.0
710140971284037632,"<a href=""http://twitter.com/download/iphone"" rel=""nofollow"">Twitter for iPhone</a>",This is Tater. His underbite is fierce af. Doesn't give a damn about your engagement photo. 8/10 https://t.co/nLuPY3pY12,https://twitter.com/dog_rates/status/710140971284037632/photo/1,8.0,10.0,Tater,,2016-03-16,16:29:35,847.0,2647.0
710117014656950272,"<a href=""http://twitter.com/download/iphone"" rel=""nofollow"">Twitter for iPhone</a>",This pupper got her hair chalked for her birthday. Hasn't told her parents yet. Rebellious af. 11/10 very nifty https://t.co/h1OX2mLtxV,"https://twitter.com/dog_rates/status/710117014656950272/photo/1,https://twitter.com/dog_rates/status/710117014656950272/photo/1",11.0,10.0,,Pupper,2016-03-16,14:54:24,1884.0,5252.0
709918798883774466,"<a href=""http://twitter.com/download/iphone"" rel=""nofollow"">Twitter for iPhone</a>",Meet Watson. He's a Suzuki Tickleboop. Leader of a notorious biker gang. Only one ear functional. 12/10 snuggable af https://t.co/R1gLc5vDqG,"https://twitter.com/dog_rates/status/709918798883774466/photo/1,https://twitter.com/dog_rates/status/709918798883774466/photo/1",12.0,10.0,Watson,,2016-03-16,01:46:45,1039.0,3371.0
709901256215666688,"<a href=""http://twitter.com/download/iphone"" rel=""nofollow"">Twitter for iPhone</a>","WeRateDogs stickers are here and they're 12/10! Use code ""puppers"" at checkout ðŸ¶ðŸ¾

Shop now: https://t.co/k5xsufRKYm https://t.co/ShXk46V13r","http://goo.gl/ArWZfi,https://twitter.com/dog_rates/status/709901256215666688/photo/1,https://twitter.com/dog_rates/status/709901256215666688/photo/1,https://twitter.com/dog_rates/status/709901256215666688/photo/1,https://twitter.com/dog_rates/status/709901256215666688/photo/1",12.0,10.0,,,2016-03-16,00:37:03,98.0,641.0
709852847387627521,"<a href=""http://twitter.com/download/iphone"" rel=""nofollow"">Twitter for iPhone</a>",*lets out a tiny whimper and then collapses* ...12/10 https://t.co/BNdVZEHRow,"https://twitter.com/dog_rates/status/709852847387627521/photo/1,https://twitter.com/dog_rates/status/709852847387627521/photo/1,https://twitter.com/dog_rates/status/709852847387627521/photo/1,https://twitter.com/dog_rates/status/709852847387627521/photo/1",12.0,10.0,,,2016-03-15,21:24:41,1151.0,3379.0
709566166965075968,"<a href=""http://twitter.com/download/iphone"" rel=""nofollow"">Twitter for iPhone</a>",This is Olaf. He's gotta be rare. Seems sturdy. Tail is floofy af. 12/10 would do whatever it takes to pet https://t.co/E9jaU59bh9,https://twitter.com/dog_rates/status/709566166965075968/photo/1,12.0,10.0,Olaf,,2016-03-15,02:25:31,1149.0,3413.0
709556954897764353,"<a href=""http://twitter.com/download/iphone"" rel=""nofollow"">Twitter for iPhone</a>",This is Cecil. She's a Gigglefloof Poofer. Outdoorsy af. One with nature. 12/10 would strategically capture https://t.co/ijJB0DuOIC,"https://twitter.com/dog_rates/status/709556954897764353/photo/1,https://twitter.com/dog_rates/status/709556954897764353/photo/1,https://twitter.com/dog_rates/status/709556954897764353/photo/1",12.0,10.0,Cecil,,2016-03-15,01:48:55,1024.0,3162.0
709519240576036864,"<a href=""http://twitter.com/download/iphone"" rel=""nofollow"">Twitter for iPhone</a>",This is Vince. He's a Gregorian Flapjeck. White spot on legs almost looks like another dog (whoa). 9/10 rad as hell https://t.co/aczGAV2dK4,https://twitter.com/dog_rates/status/709519240576036864/photo/1,9.0,10.0,Vince,,2016-03-14,23:19:03,227.0,1442.0
709449600415961088,"<a href=""http://twitter.com/download/iphone"" rel=""nofollow"">Twitter for iPhone</a>",Meet Karma. She's just a head. Lost body during the Second Punic War (unfortunate). Loves to travel 10/10 petable af https://t.co/c6af6nYEPo,"https://twitter.com/dog_rates/status/709449600415961088/photo/1,https://twitter.com/dog_rates/status/709449600415961088/photo/1",10.0,10.0,Karma,,2016-03-14,18:42:20,542.0,2126.0
709409458133323776,"<a href=""http://twitter.com/download/iphone"" rel=""nofollow"">Twitter for iPhone</a>",This is Billy. He sensed a squirrel. 8/10 damn it Billy https://t.co/Yu0K98VZ9A,https://twitter.com/dog_rates/status/709409458133323776/photo/1,8.0,10.0,Billy,,2016-03-14,16:02:49,650.0,2538.0
709225125749587968,"<a href=""http://twitter.com/download/iphone"" rel=""nofollow"">Twitter for iPhone</a>",This is Walker. He's a Butternut Khalifa. Appears fuzzy af. 11/10 would hug for a ridiculous amount of time https://t.co/k6fEWHSALn,https://twitter.com/dog_rates/status/709225125749587968/photo/1,11.0,10.0,Walker,,2016-03-14,03:50:21,544.0,2324.0
709207347839836162,"<a href=""http://twitter.com/download/iphone"" rel=""nofollow"">Twitter for iPhone</a>",This is Penny. She's trying on her prom dress. Stunning af 11/10 https://t.co/qcZDZGCapg,https://twitter.com/dog_rates/status/709207347839836162/photo/1,11.0,10.0,Penny,,2016-03-14,02:39:42,5507.0,12003.0
709198395643068416,"<a href=""http://twitter.com/download/iphone"" rel=""nofollow"">Twitter for iPhone</a>","From left to right:
Cletus, Jerome, Alejandro, Burp, &amp; Titson
None know where camera is. 45/50 would hug all at once https://t.co/sedre1ivTK",https://twitter.com/dog_rates/status/709198395643068416/photo/1,9.0,10.0,,,2016-03-14,02:04:08,612.0,2361.0
709179584944730112,"<a href=""http://vine.co"" rel=""nofollow"">Vine - Make a Scene</a>",This is Sammy. He's in a tree. Very excited about it. 13/10 https://t.co/CLe9ETEjeF,https://vine.co/v/iwAjdlEjwMl,13.0,10.0,Sammy,,2016-03-14,00:49:23,643.0,1940.0
709158332880297985,"<a href=""http://twitter.com/download/iphone"" rel=""nofollow"">Twitter for iPhone</a>",Meet Rodney. He's a Ukranian Boomchicka. Outside but would like to be inside. Only has one ear (unfortunate) 10/10 https://t.co/FjAj3ggXrR,https://twitter.com/dog_rates/status/709158332880297985/photo/1,10.0,10.0,Rodney,,2016-03-13,23:24:56,393.0,1959.0
709042156699303936,"<a href=""http://twitter.com/download/iphone"" rel=""nofollow"">Twitter for iPhone</a>",This is Klevin. He's addicted to sandwiches (yes a hotdog is a sandwich fight me) It's tearing his family apart 9/10 https://t.co/7BkkVNu5pd,https://twitter.com/dog_rates/status/709042156699303936/photo/1,9.0,10.0,Klevin,,2016-03-13,15:43:18,1560.0,4556.0
708853462201716736,"<a href=""http://vine.co"" rel=""nofollow"">Vine - Make a Scene</a>",This is Lucy. She doesn't understand fetch. 8/10 try turning off and back on (vid by @rileyyoungblood) https://t.co/RXjEwpVJf0,https://vine.co/v/iHl2UDEBZ95,8.0,10.0,Lucy,,2016-03-13,03:13:29,632.0,1741.0
708845821941387268,"<a href=""http://twitter.com/download/iphone"" rel=""nofollow"">Twitter for iPhone</a>",Here's a pupper with magic eyes. Not wearing a seat belt tho (irresponsible af). Very distracting to driver. 9/10 https://t.co/5DLJB4ssvI,"https://twitter.com/dog_rates/status/708845821941387268/photo/1,https://twitter.com/dog_rates/status/708845821941387268/photo/1",9.0,10.0,,Pupper,2016-03-13,02:43:08,855.0,2871.0
708834316713893888,"<a href=""http://twitter.com/download/iphone"" rel=""nofollow"">Twitter for iPhone</a>",Meet Malikai. He was rolling around having fun when he remembered the inevitable heat death of the universe. 10/10 https://t.co/Vd2FqHIIGn,https://twitter.com/dog_rates/status/708834316713893888/photo/1,10.0,10.0,Malikai,,2016-03-13,01:57:25,479.0,1624.0
