tweet_id,source,text,expanded_urls,rating_numerator,rating_denominator,name,dog_stage,date,time,retweet_count,favorite_count
789903600034189313,"<a href=""http://vine.co"" rel=""nofollow"">Vine - Make a Scene</a>",This is Ralphy. His dreams were just shattered. Poor pupper. 13/10 it'll be ok Ralphy https://t.co/P0kSN6rT6H,https://vine.co/v/5wPT1aBxPQZ,13.0,10.0,Ralphy,Pupper,2016-10-22,18:57:48,4067.0,10209.0
789628658055020548,"<a href=""http://twitter.com/download/iphone"" rel=""nofollow"">Twitter for iPhone</a>",This is Eli. He can fly. 13/10 magical af https://t.co/huPSJJ7FDI,https://twitter.com/dog_rates/status/789628658055020548/photo/1,13.0,10.0,Eli,,2016-10-22,00:45:17,1732.0,7388.0
789599242079838210,"<a href=""http://twitter.com/download/iphone"" rel=""nofollow"">Twitter for iPhone</a>",This is Brownie. She's wearing a Halloween themed onesie. 12/10 festive af https://t.co/0R4meWXFOx,"https://twitter.com/dog_rates/status/789599242079838210/photo/1,https://twitter.com/dog_rates/status/789599242079838210/photo/1",12.0,10.0,Brownie,,2016-10-21,22:48:24,1887.0,6652.0
789530877013393408,"<a href=""http://twitter.com/download/iphone"" rel=""nofollow"">Twitter for iPhone</a>",This is Rizzy. She smiles a lot. 12/10 contagious af https://t.co/TU4sZogVIq,"https://twitter.com/dog_rates/status/789530877013393408/photo/1,https://twitter.com/dog_rates/status/789530877013393408/photo/1,https://twitter.com/dog_rates/status/789530877013393408/photo/1",12.0,10.0,Rizzy,,2016-10-21,18:16:44,3323.0,11573.0
789314372632018944,"<a href=""http://twitter.com/download/iphone"" rel=""nofollow"">Twitter for iPhone</a>","HE WAS JUST A LIL SLEEPY FROM BEING SUCH A GOOD DOGGI ALL THE TIME MISTAKES HAPPEN 13/10
https://t.co/G2ms0A5jWM",https://twitter.com/sebscat/status/788818328538099712,13.0,10.0,,,2016-10-21,03:56:25,2254.0,8527.0
789268448748703744,"<a href=""http://twitter.com/download/iphone"" rel=""nofollow"">Twitter for iPhone</a>",This is Stella. She's happier than I will ever be. 10/10 would trade lives with https://t.co/JSs2bfDtTS,https://twitter.com/dog_rates/status/789268448748703744/photo/1,10.0,10.0,Stella,,2016-10-21,00:53:56,2565.0,8996.0
789137962068021249,"<a href=""http://twitter.com/download/iphone"" rel=""nofollow"">Twitter for iPhone</a>",This is Bo. He's a West Congolese Bugaboop Snuggle. Rather exotic. Master of the head tilt. 12/10 would pay to pet https://t.co/2jwxxtNzoN,"https://twitter.com/dog_rates/status/789137962068021249/photo/1,https://twitter.com/dog_rates/status/789137962068021249/photo/1,https://twitter.com/dog_rates/status/789137962068021249/photo/1",12.0,10.0,Bo,,2016-10-20,16:15:26,2742.0,9578.0
788908386943430656,"<a href=""http://twitter.com/download/iphone"" rel=""nofollow"">Twitter for iPhone</a>","This is Lucy. She destroyed not one, but two remotes trying to turn off the debate. 11/10 relatable af https://t.co/3BXh073tDm",https://twitter.com/dog_rates/status/788908386943430656/photo/1,11.0,10.0,Lucy,,2016-10-20,01:03:11,12273.0,27084.0
788765914992902144,"<a href=""http://twitter.com/download/iphone"" rel=""nofollow"">Twitter for iPhone</a>",This is Butter. She can have whatever she wants forever. 12/10 would hug softly https://t.co/x5gXRS1abq,https://twitter.com/dog_rates/status/788765914992902144/photo/1,12.0,10.0,Butter,,2016-10-19,15:37:03,10115.0,26974.0
788412144018661376,"<a href=""http://twitter.com/download/iphone"" rel=""nofollow"">Twitter for iPhone</a>",This is Dexter. He breaks hearts for a living. 11/10 h*ckin handsome af https://t.co/4DhSsC1W7S,"https://twitter.com/dog_rates/status/788412144018661376/photo/1,https://twitter.com/dog_rates/status/788412144018661376/photo/1",11.0,10.0,Dexter,,2016-10-18,16:11:17,5170.0,15332.0
788178268662984705,"<a href=""http://twitter.com/download/iphone"" rel=""nofollow"">Twitter for iPhone</a>",Atlas is back and this time he's got doggles. Still 13/10 solarly conscious af https://t.co/s7MgFWDySc,"https://twitter.com/dog_rates/status/788178268662984705/photo/1,https://twitter.com/dog_rates/status/788178268662984705/photo/1,https://twitter.com/dog_rates/status/788178268662984705/photo/1,https://twitter.com/dog_rates/status/788178268662984705/photo/1",13.0,10.0,,,2016-10-18,00:41:57,2059.0,7141.0
788150585577050112,"<a href=""http://twitter.com/download/iphone"" rel=""nofollow"">Twitter for iPhone</a>",This is Leo. He's a golden chow. Rather h*ckin rare. 13/10 would give extra pats https://t.co/xosHjFzVXc,"https://twitter.com/dog_rates/status/788150585577050112/photo/1,https://twitter.com/dog_rates/status/788150585577050112/photo/1,https://twitter.com/dog_rates/status/788150585577050112/photo/1,https://twitter.com/dog_rates/status/788150585577050112/photo/1",13.0,10.0,Leo,,2016-10-17,22:51:57,1254.0,6038.0
788039637453406209,"<a href=""http://twitter.com/download/iphone"" rel=""nofollow"">Twitter for iPhone</a>",Did... did they pick out that license plate? 12/10 for both https://t.co/lRmUUOxgbQ,"https://twitter.com/dog_rates/status/788039637453406209/photo/1,https://twitter.com/dog_rates/status/788039637453406209/photo/1",12.0,10.0,,,2016-10-17,15:31:05,1287.0,6049.0
787810552592695296,"<a href=""http://twitter.com/download/iphone"" rel=""nofollow"">Twitter for iPhone</a>",This is Frank. He wears sunglasses and walks himself. 11/10 I'll never be this cool or independent https://t.co/pNNjBtHWPc,"https://twitter.com/dog_rates/status/787810552592695296/photo/1,https://twitter.com/dog_rates/status/787810552592695296/photo/1",11.0,10.0,Frank,,2016-10-17,00:20:47,2991.0,8509.0
787717603741622272,"<a href=""http://twitter.com/download/iphone"" rel=""nofollow"">Twitter for iPhone</a>",This is Tonks. She is a service puppo. Can hear a caterpillar hiccup from 7 miles away. 13/10 would follow anywhere https://t.co/i622ZbWkUp,"https://twitter.com/dog_rates/status/787717603741622272/photo/1,https://twitter.com/dog_rates/status/787717603741622272/photo/1,https://twitter.com/dog_rates/status/787717603741622272/photo/1,https://twitter.com/dog_rates/status/787717603741622272/photo/1",13.0,10.0,Tonks,Puppo,2016-10-16,18:11:26,2725.0,10130.0
787397959788929025,"<a href=""http://twitter.com/download/iphone"" rel=""nofollow"">Twitter for iPhone</a>",This is Moose. He's rather h*ckin dangerous (you can tell by the collar). 11/10 would still attempt to snug https://t.co/lHVHGdDzb3,https://twitter.com/dog_rates/status/787397959788929025/photo/1,11.0,10.0,Moose,,2016-10-15,21:01:17,2799.0,10755.0
787322443945877504,"<a href=""http://twitter.com/download/iphone"" rel=""nofollow"">Twitter for iPhone</a>",This is Lincoln. He forgot to use his blinker when he changed lanes just now. Guilty as h*ck. Still 10/10 https://t.co/lsrR83SiVp,https://twitter.com/dog_rates/status/787322443945877504/photo/1,10.0,10.0,Lincoln,,2016-10-15,16:01:13,1707.0,7687.0
786963064373534720,"<a href=""http://twitter.com/download/iphone"" rel=""nofollow"">Twitter for iPhone</a>",This is Rory. He's got an interview in a few minutes. Looking spiffy af. Nervous as h*ck tho. 12/10 would hire https://t.co/ibj5g6xaAj,https://twitter.com/dog_rates/status/786963064373534720/photo/1,12.0,10.0,Rory,,2016-10-14,16:13:10,7828.0,26278.0
786709082849828864,"<a href=""http://twitter.com/download/iphone"" rel=""nofollow"">Twitter for iPhone</a>","This is Logan, the Chow who lived. He solemnly swears he's up to lots of good. H*ckin magical af 9.75/10 https://t.co/yBO5wuqaPS",https://twitter.com/dog_rates/status/786709082849828864/photo/1,9.75,10.0,Logan,,2016-10-13,23:23:56,6014.0,18027.0
786664955043049472,"<a href=""http://twitter.com/download/iphone"" rel=""nofollow"">Twitter for iPhone</a>","""Honestly Kathleen I just want more Ken Bone"" 12/10 https://t.co/HmlEvAMP4r",https://twitter.com/dog_rates/status/786664955043049472/photo/1,12.0,10.0,,,2016-10-13,20:28:35,2490.0,10453.0
786595970293370880,"<a href=""http://twitter.com/download/iphone"" rel=""nofollow"">Twitter for iPhone</a>",This is Dale. He's a real spookster. Did me quite the frighten. 11/10 not too spooky to pet tho https://t.co/L8BWDD4oBX,https://twitter.com/dog_rates/status/786595970293370880/photo/1,11.0,10.0,Dale,,2016-10-13,15:54:28,3076.0,9342.0
786363235746385920,"<a href=""http://twitter.com/download/iphone"" rel=""nofollow"">Twitter for iPhone</a>",This is Rizzo. He has many talents. A true renaissance doggo. 13/10 entertaining af https://t.co/TVXpEJB7Wn,"https://twitter.com/dog_rates/status/786363235746385920/photo/1,https://twitter.com/dog_rates/status/786363235746385920/photo/1,https://twitter.com/dog_rates/status/786363235746385920/photo/1,https://twitter.com/dog_rates/status/786363235746385920/photo/1",13.0,10.0,Rizzo,Doggo,2016-10-13,00:29:39,3408.0,10742.0
786286427768250368,"<a href=""http://vine.co"" rel=""nofollow"">Vine - Make a Scene</a>",This is Arnie. He's afraid of his own bark. 12/10 would comfort https://t.co/ObT2tSxXit,https://vine.co/v/5XH0WqHwiFp,12.0,10.0,Arnie,,2016-10-12,19:24:27,2778.0,7870.0
786233965241827333,"<a href=""http://twitter.com/download/iphone"" rel=""nofollow"">Twitter for iPhone</a>",This is Mattie. She's extremely dangerous. Will bite your h*ckin finger right off. Still 11/10 would pet with caution https://t.co/78c9W8kLFh,https://twitter.com/dog_rates/status/786233965241827333/photo/1,11.0,10.0,Mattie,,2016-10-12,15:55:59,4618.0,15026.0
785927819176054784,"<a href=""http://twitter.com/download/iphone"" rel=""nofollow"">Twitter for iPhone</a>",This is Lucy. She's strives to be the best potato she can be. 12/10 would boop https://t.co/lntsj7Fc4Y,https://twitter.com/dog_rates/status/785927819176054784/photo/1,12.0,10.0,Lucy,,2016-10-11,19:39:28,3128.0,11229.0
785872687017132033,"<a href=""http://twitter.com/download/iphone"" rel=""nofollow"">Twitter for iPhone</a>",Meet Rusty. He appears to be rather h*ckin fluffy. Also downright adorable af. 12/10 would rub my face against his https://t.co/1j9kLGb4wV,https://twitter.com/dog_rates/status/785872687017132033/video/1,12.0,10.0,Rusty,,2016-10-11,16:00:24,1765.0,6616.0
785639753186217984,"<a href=""http://twitter.com/download/iphone"" rel=""nofollow"">Twitter for iPhone</a>",This is Pinot. He's a sophisticated doggo. You can tell by the hat. Also pointier than your average pupper. Still 10/10 would pet cautiously https://t.co/f2wmLZTPHd,"https://twitter.com/dog_rates/status/785639753186217984/photo/1,https://twitter.com/dog_rates/status/785639753186217984/photo/1",10.0,10.0,Pinot,Various,2016-10-11,00:34:48,2196.0,7764.0
785533386513321988,"<a href=""http://twitter.com/download/iphone"" rel=""nofollow"">Twitter for iPhone</a>",This is Dallas. Her tongue is ridiculous. 11/10 h*ckin proud af https://t.co/h4jhlH4EyG,"https://twitter.com/dog_rates/status/785533386513321988/photo/1,https://twitter.com/dog_rates/status/785533386513321988/photo/1",11.0,10.0,Dallas,,2016-10-10,17:32:08,1953.0,8968.0
785264754247995392,"<a href=""http://twitter.com/download/iphone"" rel=""nofollow"">Twitter for iPhone</a>",This is Doc. He requested to be carried around like that. 12/10 anything for Doc https://t.co/mWYACm4qnx,https://twitter.com/dog_rates/status/785264754247995392/photo/1,12.0,10.0,Doc,,2016-10-09,23:44:41,1594.0,7166.0
785170936622350336,"<a href=""http://twitter.com/download/iphone"" rel=""nofollow"">Twitter for iPhone</a>",This is Hero. He was enjoying the car ride until he remembered that bees are dying globally at an alarming rate. 11/10 https://t.co/cubFg7F4qQ,"https://twitter.com/dog_rates/status/785170936622350336/photo/1,https://twitter.com/dog_rates/status/785170936622350336/photo/1,https://twitter.com/dog_rates/status/785170936622350336/photo/1,https://twitter.com/dog_rates/status/785170936622350336/photo/1",11.0,10.0,Hero,,2016-10-09,17:31:53,4724.0,11858.0
784826020293709826,"<a href=""http://twitter.com/download/iphone"" rel=""nofollow"">Twitter for iPhone</a>",This is Rusty. He's going D1 for sure. Insane vertical. 13/10 would draft https://t.co/AsykOwMrXQ,https://twitter.com/dog_rates/status/784826020293709826/photo/1,13.0,10.0,Rusty,,2016-10-08,18:41:19,3172.0,9956.0
784517518371221505,"<a href=""http://twitter.com/download/iphone"" rel=""nofollow"">Twitter for iPhone</a>",This is Frankie. He has yet to learn how to control his tongue. 11/10 maybe one day https://t.co/p6fgYe2dB6,"https://twitter.com/dog_rates/status/784517518371221505/photo/1,https://twitter.com/dog_rates/status/784517518371221505/photo/1,https://twitter.com/dog_rates/status/784517518371221505/photo/1",11.0,10.0,Frankie,,2016-10-07,22:15:26,2475.0,8854.0
784431430411685888,"<a href=""http://twitter.com/download/iphone"" rel=""nofollow"">Twitter for iPhone</a>",This is Stormy. He's curly af. Already pupared for Coachella next year. 12/10 https://t.co/PHA1vtqqpt,https://twitter.com/dog_rates/status/784431430411685888/photo/1,12.0,10.0,Stormy,,2016-10-07,16:33:21,1246.0,5657.0
784183165795655680,"<a href=""http://vine.co"" rel=""nofollow"">Vine - Make a Scene</a>",This is Reginald. He's one magical puppo. Aerodynamic af. 12/10 would catch https://t.co/t0cEeRbcXJ,https://vine.co/v/5ghHLBMMdlV,12.0,10.0,Reginald,Puppo,2016-10-07,00:06:50,7865.0,19742.0
784057939640352768,"<a href=""http://vine.co"" rel=""nofollow"">Vine - Make a Scene</a>",This is Balto. He's very content. Legendary tongue slippage. 12/10 would pet forever https://t.co/T7Jr4Gw4sC,https://vine.co/v/5gKxeUpuKEr,12.0,10.0,Balto,,2016-10-06,15:49:14,10864.0,29301.0
783839966405230592,"<a href=""http://twitter.com/download/iphone"" rel=""nofollow"">Twitter for iPhone</a>",This is Riley. His owner put a donut pillow around him and he loves it so much he won't let anyone take it off. 13/10 https://t.co/8TCQcsZCZ8,"https://twitter.com/dog_rates/status/783839966405230592/photo/1,https://twitter.com/dog_rates/status/783839966405230592/photo/1,https://twitter.com/dog_rates/status/783839966405230592/photo/1",13.0,10.0,Riley,,2016-10-06,01:23:05,10578.0,29534.0
783821107061198850,"<a href=""http://twitter.com/download/iphone"" rel=""nofollow"">Twitter for iPhone</a>",This is Mairi. She has mastered the art of camouflage. 12/10 h*ckin sneaky af https://t.co/STcPjiNAHp,"https://twitter.com/dog_rates/status/783821107061198850/photo/1,https://twitter.com/dog_rates/status/783821107061198850/photo/1",12.0,10.0,Mairi,,2016-10-06,00:08:09,1922.0,7266.0
783695101801398276,"<a href=""http://twitter.com/download/iphone"" rel=""nofollow"">Twitter for iPhone</a>",This is Loomis. He's the leader of the Kenneth search party. The passion is almost overwhelming. 12/10 one day he will be free https://t.co/kCRKlFg4AY,"https://twitter.com/dog_rates/status/783695101801398276/photo/1,https://twitter.com/dog_rates/status/783695101801398276/photo/1,https://twitter.com/dog_rates/status/783695101801398276/photo/1",12.0,10.0,Loomis,,2016-10-05,15:47:27,3149.0,10313.0
783466772167098368,"<a href=""http://twitter.com/download/iphone"" rel=""nofollow"">Twitter for iPhone</a>",This is Finn. He likes eavesdropping from filing cabinets. It's a real issue but no one has approached him about it. 11/10 would still pet https://t.co/s8W8Del9HQ,"https://twitter.com/dog_rates/status/783466772167098368/photo/1,https://twitter.com/dog_rates/status/783466772167098368/photo/1",11.0,10.0,Finn,,2016-10-05,00:40:09,2185.0,8324.0
783391753726550016,"<a href=""http://twitter.com/download/iphone"" rel=""nofollow"">Twitter for iPhone</a>",Meet Godi. He's an avid beachgoer and part time rainbow summoner. Eyeliner flawless af. 13/10 would snug well https://t.co/BO936YdJdi,"https://twitter.com/dog_rates/status/783391753726550016/photo/1,https://twitter.com/dog_rates/status/783391753726550016/photo/1,https://twitter.com/dog_rates/status/783391753726550016/photo/1,https://twitter.com/dog_rates/status/783391753726550016/photo/1",13.0,10.0,Godi,,2016-10-04,19:42:03,5345.0,16647.0
783334639985389568,"<a href=""http://twitter.com/download/iphone"" rel=""nofollow"">Twitter for iPhone</a>",This is Dave. He's currently in a predicament. Doesn't seem to mind tho. 12/10 someone assist Dave https://t.co/nfprKAXqwu,"https://twitter.com/dog_rates/status/783334639985389568/photo/1,https://twitter.com/dog_rates/status/783334639985389568/photo/1,https://twitter.com/dog_rates/status/783334639985389568/photo/1",12.0,10.0,Dave,,2016-10-04,15:55:06,11425.0,28667.0
783085703974514689,"<a href=""http://twitter.com/download/iphone"" rel=""nofollow"">Twitter for iPhone</a>",This is Earl. He can't catch. Did his best tho. 11/10 would repair confidence with extra pats https://t.co/IsqyvbjFgM,"https://twitter.com/dog_rates/status/783085703974514689/photo/1,https://twitter.com/dog_rates/status/783085703974514689/photo/1",11.0,10.0,Earl,,2016-10-03,23:25:55,2148.0,8044.0
782969140009107456,"<a href=""http://twitter.com/download/iphone"" rel=""nofollow"">Twitter for iPhone</a>",This is Cali. She arrived preassembled. Convenient af. 12/10 appears to be rather h*ckin pettable https://t.co/vOBV1ZqVcX,"https://twitter.com/dog_rates/status/782969140009107456/photo/1,https://twitter.com/dog_rates/status/782969140009107456/photo/1",12.0,10.0,Cali,,2016-10-03,15:42:44,7200.0,23777.0
782747134529531904,"<a href=""http://twitter.com/download/iphone"" rel=""nofollow"">Twitter for iPhone</a>",This is Deacon. He's the happiest almost dry doggo I've ever seen. 11/10 would smile back https://t.co/C6fUMnHt1H,https://twitter.com/dog_rates/status/782747134529531904/photo/1,11.0,10.0,Deacon,Doggo,2016-10-03,01:00:34,1383.0,7363.0
782722598790725632,"<a href=""http://twitter.com/download/iphone"" rel=""nofollow"">Twitter for iPhone</a>","This is Penny. She fought a bee and the bee won. 10/10 you're fine Penny, everything's fine https://t.co/zrMVdfFej6",https://twitter.com/dog_rates/status/782722598790725632/photo/1,10.0,10.0,Penny,,2016-10-02,23:23:04,5273.0,16994.0
782598640137187329,"<a href=""http://twitter.com/download/iphone"" rel=""nofollow"">Twitter for iPhone</a>",This is Timmy. He's quite large. According to a trusted source it's actually a dog wearing a dog suit. 11/10 https://t.co/BIUchFwHqn,https://twitter.com/dog_rates/status/782598640137187329/photo/1,11.0,10.0,Timmy,,2016-10-02,15:10:30,1836.0,7685.0
782305867769217024,"<a href=""http://twitter.com/download/iphone"" rel=""nofollow"">Twitter for iPhone</a>",This is Sampson. He just graduated. Ready to be a doggo now. Time for the real world. 12/10 have fun with taxes https://t.co/pgVKxRw0s1,"https://twitter.com/dog_rates/status/782305867769217024/photo/1,https://twitter.com/dog_rates/status/782305867769217024/photo/1,https://twitter.com/dog_rates/status/782305867769217024/photo/1",12.0,10.0,Sampson,Doggo,2016-10-01,19:47:08,5419.0,16390.0
781955203444699136,"<a href=""http://twitter.com/download/iphone"" rel=""nofollow"">Twitter for iPhone</a>",This is Chipson. He weighed in at .3 ounces and is officially super h*ckin smol. Space-saving af. 11/10 would snug delicately https://t.co/FjEsk7A1JV,https://twitter.com/dog_rates/status/781955203444699136/photo/1,11.0,10.0,Chipson,,2016-09-30,20:33:43,3298.0,10967.0
781661882474196992,"<a href=""http://twitter.com/download/iphone"" rel=""nofollow"">Twitter for iPhone</a>",Who keeps sending in pictures without dogs in them? This needs to stop. 5/10 for the mediocre road https://t.co/ELqelxWMrC,https://twitter.com/dog_rates/status/781661882474196992/photo/1,5.0,10.0,,,2016-09-30,01:08:10,2658.0,10275.0
781655249211752448,"<a href=""http://vine.co"" rel=""nofollow"">Vine - Make a Scene</a>",This is Combo. The daily struggles of being a doggo have finally caught up with him. 11/10 https://t.co/LOKrNo0OM7,https://vine.co/v/5rt6T3qm7hL,11.0,10.0,Combo,Doggo,2016-09-30,00:41:48,1105.0,3935.0
781524693396357120,"<a href=""http://twitter.com/download/iphone"" rel=""nofollow"">Twitter for iPhone</a>",Idk why this keeps happening. We only rate dogs. Not Bangladeshi Couch Chipmunks. Please only send dogs... 12/10 https://t.co/ya7bviQUUf,https://twitter.com/dog_rates/status/781524693396357120/photo/1,12.0,10.0,,,2016-09-29,16:03:01,5434.0,20428.0
781308096455073793,"<a href=""http://vine.co"" rel=""nofollow"">Vine - Make a Scene</a>","Pupper butt 1, Doggo 0. Both 12/10 https://t.co/WQvcPEpH2u",https://vine.co/v/5rgu2Law2ut,12.0,10.0,,Various,2016-09-29,01:42:20,2500.0,7028.0
781251288990355457,"<a href=""http://twitter.com/download/iphone"" rel=""nofollow"">Twitter for iPhone</a>",This is Oakley. He just got yelled at for going 46 in a 45. Churlish af. 11/10 would still pet so well https://t.co/xIYsa6LPA4,"https://twitter.com/dog_rates/status/781251288990355457/photo/1,https://twitter.com/dog_rates/status/781251288990355457/photo/1",11.0,10.0,Oakley,,2016-09-28,21:56:36,2029.0,8279.0
781163403222056960,"<a href=""http://twitter.com/download/iphone"" rel=""nofollow"">Twitter for iPhone</a>","We normally don't rate lobsters, but this one appears to be a really good lobster. 10/10 would pet with caution https://t.co/YkHc7U7uUy",https://twitter.com/dog_rates/status/781163403222056960/photo/1,10.0,10.0,,,2016-09-28,16:07:23,2695.0,9644.0
780931614150983680,"<a href=""http://twitter.com/download/iphone"" rel=""nofollow"">Twitter for iPhone</a>",I want to finally rate this iconic puppo who thinks the parade is all for him. 13/10 would absolutely attend https://t.co/5dUYOu4b8d,https://twitter.com/dog_rates/status/780931614150983680/photo/1,13.0,10.0,,Puppo,2016-09-28,00:46:20,7111.0,21257.0
780858289093574656,"<a href=""http://twitter.com/download/iphone"" rel=""nofollow"">Twitter for iPhone</a>","This is Dash. He's very stylish, but also incredibly unimpressed with the current state of our nation. 10/10 would pet ears first https://t.co/YElO4hvXI6",https://twitter.com/dog_rates/status/780858289093574656/photo/1,10.0,10.0,Dash,,2016-09-27,19:54:58,1961.0,7085.0
780800785462489090,"<a href=""http://twitter.com/download/iphone"" rel=""nofollow"">Twitter for iPhone</a>",This is Koda. He has a weird relationship with tall grass. Slightly concerning. 11/10 would def still pet https://t.co/KQzSR8eCsw,"https://twitter.com/dog_rates/status/780800785462489090/photo/1,https://twitter.com/dog_rates/status/780800785462489090/photo/1,https://twitter.com/dog_rates/status/780800785462489090/photo/1",11.0,10.0,Koda,,2016-09-27,16:06:28,1263.0,5391.0
780601303617732608,"<a href=""http://twitter.com/download/iphone"" rel=""nofollow"">Twitter for iPhone</a>",Meet Hercules. He can have whatever he wants for the rest of eternity. 12/10 would snug passionately https://t.co/mH0IOyFdIG,https://twitter.com/dog_rates/status/780601303617732608/photo/1,12.0,10.0,Hercules,,2016-09-27,02:53:48,3288.0,11898.0
780543529827336192,"<a href=""http://twitter.com/download/iphone"" rel=""nofollow"">Twitter for iPhone</a>",Here's a perturbed super floof. 12/10 would snug so damn well https://t.co/VG095mi09Q,https://twitter.com/dog_rates/status/780543529827336192/photo/1,12.0,10.0,,,2016-09-26,23:04:13,1705.0,6193.0
780459368902959104,"<a href=""http://twitter.com/download/iphone"" rel=""nofollow"">Twitter for iPhone</a>","This is Bear. Don't worry, he's not a real bear tho. Contains unreal amounts of squish. 11/10 heteroskedastic af https://t.co/coi4l1T2Sm",https://twitter.com/dog_rates/status/780459368902959104/photo/1,11.0,10.0,Bear,,2016-09-26,17:29:48,1048.0,5201.0
780192070812196864,"<a href=""http://twitter.com/download/iphone"" rel=""nofollow"">Twitter for iPhone</a>",We only rate dogs. Pls stop sending in non-canines like this Urban Floof Giraffe. I can't handle this. 11/10 https://t.co/zHIqpM5Gni,https://twitter.com/dog_rates/status/780192070812196864/photo/1,11.0,10.0,,,2016-09-25,23:47:39,2190.0,8551.0
780074436359819264,"<a href=""http://vine.co"" rel=""nofollow"">Vine - Make a Scene</a>",Here's a doggo questioning his entire existence. 10/10 someone tell him he's a good boy  https://t.co/dVm5Hgdpeb,https://vine.co/v/5nzYBpl0TY2,10.0,10.0,,Doggo,2016-09-25,16:00:13,4829.0,11922.0
779834332596887552,"<a href=""http://twitter.com/download/iphone"" rel=""nofollow"">Twitter for iPhone</a>",This is Scout. He really wants to kiss himself. H*ckin inappropriate. 11/10 narcissistic af https://t.co/x0gV2Ck3AD,"https://twitter.com/dog_rates/status/779834332596887552/photo/1,https://twitter.com/dog_rates/status/779834332596887552/photo/1,https://twitter.com/dog_rates/status/779834332596887552/photo/1,https://twitter.com/dog_rates/status/779834332596887552/photo/1",11.0,10.0,Scout,,2016-09-25,00:06:08,6847.0,18543.0
779377524342161408,"<a href=""http://twitter.com/download/iphone"" rel=""nofollow"">Twitter for iPhone</a>",Have you ever seen such a smol pupper? Portable af. 12/10 would keep in shirt pocket https://t.co/KsqaIzlQ12,https://twitter.com/dog_rates/status/779377524342161408/video/1,12.0,10.0,,Pupper,2016-09-23,17:50:56,3035.0,8612.0
779056095788752897,"<a href=""http://twitter.com/download/iphone"" rel=""nofollow"">Twitter for iPhone</a>",Everybody drop what you're doing and look at this dog. 13/10 must be super h*ckin rare https://t.co/I1bJUzUEW5,"https://twitter.com/dog_rates/status/779056095788752897/photo/1,https://twitter.com/dog_rates/status/779056095788752897/photo/1",13.0,10.0,,,2016-09-22,20:33:42,4412.0,14490.0
778990705243029504,"<a href=""http://twitter.com/download/iphone"" rel=""nofollow"">Twitter for iPhone</a>",This is Jay. He's really h*ckin happy about the start of fall. Sneaky tongue slip in 2nd pic. 11/10 snuggly af https://t.co/vyx1X5eyWI,"https://twitter.com/dog_rates/status/778990705243029504/photo/1,https://twitter.com/dog_rates/status/778990705243029504/photo/1",11.0,10.0,Jay,,2016-09-22,16:13:51,7000.0,19579.0
778764940568104960,"<a href=""http://twitter.com/download/iphone"" rel=""nofollow"">Twitter for iPhone</a>","Oh my god it's Narcos but Barkos. 13/10 someone please make this happen
https://t.co/tird9cIlzB",https://m.youtube.com/watch?v=idKxCMsS3FQ&feature=youtu.be,13.0,10.0,,,2016-09-22,01:16:45,353.0,848.0
